{
  "name": "demo",
  "environment": "dev",
  "location": "northeurope",
  "container_image": "ghcr.io/main0034/aaas-app-demo:d3ab5dff49d7a9b1e0de46e743a833c93a8be8aa",
  "container_port": 8000,
  "cpu": 0.25,
  "memory": "0.5Gi",
  "min_replicas": 0,
  "max_replicas": 2,
  "app_env": {
    "APP_NAME": "demo",
    "LOG_LEVEL": "debug"
  },
  "postgres_sku": "B_Standard_B1ms",
  "postgres_storage_mb": 32768,
  "postgres_version": "16",
  "database_name": "appdb",
  "postgres_backup_retention_days": 7,
  "registry_server": "ghcr.io",
  "registry_username": "",
  "vnet_address_space": "10.60.0.0/16",
  "tags": {
    "owner": "martin",
    "costCenter": "poc"
  }
}
